{
  "eventId": "evt_userregistered_001",
  "eventType": "UserRegistered",
  "schemaVersion": 1,
  "occurredAt": "2026-08-10T02:00:00Z",
  "publishedAt": "2026-08-10T02:00:01Z",
  "producer": "SYS-01",
  "environment": "DEV",
  "audience": [
    "SYS-01"
  ],
  "enterpriseId": null,
  "aggregateType": "User",
  "aggregateId": "usr_contract_001",
  "aggregateVersion": 1,
  "traceId": "trace_contract_fixture_001",
  "causationId": null,
  "correlationId": "corr_contract_fixture_001",
  "idempotencyKey": "USER_REGISTERED:usr_contract_001:1",
  "payload": {
    "userId": "usr_contract_001",
    "userVersion": 1,
    "registrationMethod": "PHONE",
    "clientType": "WORKBENCH",
    "registeredAt": "2026-08-10T02:00:00Z"
  }
}
